Title,Artist,Lyrics
Jump Around,House of Pain,"Pack it up, pack it in Let me begin I came to win Battle me that's a sin I won't tear the sack up Punk you'd better back up Try and play the role and the whole crew will act up Get up, stand up, come on! Come on, throw your hands up If you've got the feeling jump across the ceiling Muggs is a funk fest, someone's talking junk Yo, I'll bust em in the eye And then I'll take the punks home Feel it, funk it Amps it are junking And I got more rhymes than there's cops that are dunking Donuts shop Sure 'nuff I got props from the kids on the Hill Plus my mom and my pops  So get out your seats and jump around Jump up Jump up and get down  I'll serve your ass like John MacEnroe If your steps up, I'm smacking the ho Word to your moms I came to drop bombs I got more rhymes than the bible's got psalms And just like the Prodigal Son I've returned Anyone stepping to me you'll get burned Cause I got lyrics and you ain't got none So if you come to battle bring a shotgun But if you do you're a fool, cause I duel to the death Try and step to me you'll take your last breath I gots the skill, come get your fill Cause when I shoot ta give, I shoot to kill   Listen to the sound that pounds, I jump around I'm no clown, I get down To the funk, listen to the wig out And step to the rear, dear, cause I'm here The P to the E to the T E rockin' The runs in your stockin' So hon, put the lock in Chillin' with the House Of Pain Blood stains the ground Huh, I jump around I'm the cream of the crop, I rise to the top I never eat a pig cause a pig is a cop Or better yet a terminator Like Arnold Schwarzenegger Try'n to play me out like as if my name was Sega But I ain't going out like no punk bitch Get used to one style and you know I might switch It up up and around, then buck buck you down Put out your head then you wake up in the Dawn of the Dead I'm coming to get ya, coming to get ya Spitting out lyrics homie I'll wet ya "
Diamonds and Pearls,Prince,
Don't Let the Sun Go Down on Me,George Michael,"I can't light no more of your darkness All my pictures seem to fade to black and white I'm growing tired and time stands still before me Frozen here on the ladder of my life  It's much to late to save myself from falling I took a chance and changed your way of life But you misread my meaning when I met you Closed the door and left me blinded by the light  chorus : Don't let the sun go down on me Although I search myself, it's always someone else I see I'd just allow a fragment of your life to wander free But losing everything is like the sun going down on me  I can't find oh, the right romantic line But see me once and see the way I feel Don't discard me just because you think I mean you harm But these cuts I have, oh they need love to help them heal  chorus (x 2)"
Masterpiece,Atlantic Starr,
If You Asked Me To,Celine Dion,"Used to be that I believed in something  Used to be that I believed in love  It's been a long time since I've had that feeling  I could love someone  I could trust someone  I said I'd never let nobody near my heart again darlin'  I said I'd never let nobody in   But if you asked me to  I just might change my mind  And let you in my life forever  If you asked me to  I just might give my heart  And stay here in your arms forever  If you asked me to  If you asked me to   Somehow ever since I've been around you  Can't go back to being on my own  Can't help feeling darling since I've found you  That I've found my home  That I'm finally home  I said I'd never let nobody get too close to me darling  I said I needed, needed to be free   (But if you asked me to...)   Asked me to, I will give my world to you baby  I need you now  Ask me to and I'll do anything for you baby, for you baby   If you asked me to  I'd let you in my life forever  If you asked me to..."
Giving Him Something He Can Feel,En Vogue,"(Shoo) Verse 1 Many say that I'm too young to let you know just where I'm coming from. But you will see it's just a matter of time my love surely make you mine (1) Well, I'm Livin' in a world of ghetto life Everyone is so uptight Nothin's wrong, it's alright, my man I like the way we carry on His love will send me on and on with my man People out there can understand (2) I'm givin him somethin he can feel to let him know this love is real This love is real Verse 2 So much joy for us it seems So much hope for material things Are they only in my dreams? (hey, oh yeah) And that's exactly why I'm singing this song to you To let you know that real dreams do come true. You tell me 'what does it mean'. Repeat (1) Repeat (2) to a fade"
Live and Learn,Joe Public,
Come and Talk to Me,Jodeci,
Smells Like Teen Spirit,Nirvana,"Load up on guns and bring your friends It's fun to lose and to pretend She's over bored and self assured Oh no, I know a dirty word Hello, hello, hello, how low I'm worse at what I do best And for this gift I feel blessed Our little group has always been And always will until the end Hello, hello, hello, how low And I forget just why I taste  Oh yeah, I guess it makes me smile I found it hard, it was hard to find  Oh well, whatever, nevermind Hello, hello, hello, how low With the lights out it's less dangerous Here we are now, entertain us I feel stupid and contagious Here we are now, entertain us A mulatto An albino A mosquito My Libido Yay, a denial"
Humpin' Around,Bobby Brown,"A one in a million chance You know the moment that you crossed over the line A casual glance No one has to read between the lines In the south of France it was spring time Special feelings come alive There's romance in the air, so they say Love could be a small cafe away  Love is a piece of cake And making love is all there is to eat It's a heart out of a lamb When yoy start to feel forever in a kiss But you must remember there's no point of refuge You only have a part in a lover's play And you could be the one left in the dark If someone takes a shortcut to your heart  All too soon you're touching for the last time No one has to tell you how it is It's just a memory two people share File it under foreign affair"
Damn I Wish I Was Your Lover,Sophie B. Hawkins,"That old dog has chained you up alright  Give you everything you need  To live inside a twisted cage  Sleep beside an empty rage  I had a dream I was your hero   Damn I wish I was your lover  I'll rock you till the daylight comes  Make sure you are smiling and warm  I am everything  Tonight I'll be your mother I will  Do such things to ease your pain  Free your mind and you won't feel ashamed   Open up on the inside gonna fill you up gonna make you cry   This monkey can't stand to see you black and blue  Give you something sweet each time you  Come inside my jungle book  What is it just too good  Don't say you'll stay  'Cause then you go away   Damn I wish I was your lover  I'll rock you till the daylight comes  Make sure you are smiling and warm  I am everything  Tonight I'll be your mother I will  Do such things to ease your pain  Free your mind and you won't feel ashamed   Shucks, for me there is no other  You're the only shoe that fits  I can't imagine I'll grow out of it  Damn I wish I was your lover   If I was your girl believe me  I'd turn on the Rolling Stones  We could groove along and feel much better  I could do it forever and ever  Give me an hour to kiss you  Walk through heaven's door I'm sure  We don't need no doctor to feel much better  Let me in  Forever and ever and ever and ever   I sat on a mountainside with peace of mind  I lay by the ocean making love to her with visions clear  Walked for days with no one near  And I return as chained and bound to you   Damn I wish I was your lover  I'll rock you till the daylight comes  Make sure you are smiling and warm  I am everything  Tonight I'll be your mother I will  Do such things to ease your pain  Free your mind and you won't feel ashamed   Shucks, for me there is no other  You're the only shoe that fits  I can't imagine I'll grow out of it  Damn I wish I was your lover   Just open up I'm gonna come inside I wanna fill you up I wanna make you cry.....  (Damn I wish I was your lover)  Gettin' on the subway and I'm comin' uptown....  (Damn I wish I was your lover)  Standing on a street corner waiting for my love to change....  (Damn I wish I was your lover)  Feelin' like a school boy, too shy and too young....  (Damn I wish I was your lover)  Open up I wanna come inside I wana fill you up I wanna make you cry....  (Damn I wish I was your lover)  Gettin' on my camel and I'll ride it uptown....  (Damn I wish I was your lover)  Hanging around this jungle, wishing that this....."
Tell Me What You Want Me to Do,Tevin Campbell,
Ain't 2 Proud 2 Beg,TLC,"Yo mic check 1-2, 1-2 We in the house Yeah come on 1992 TLC kickin' off in your Mutha... So ya best be duckin' fast Yo T-Boz is ya being a boss Chilli what's up wit' dat sauce Dis is it Yo ""T"" step on that (shhh)  I ain't 2 proud, I ain't 2 proud 2 beg Thinkin' short of what you got Better get it while it's hot Ain't no better love than your own Unmistakin' urge 2 be sexin' with society How can you be happy alone  When I need 2 feel love  Why wait 4 so long Cause I ain't 2 proud 2 beg  4 something that I call my own And I want 2 be touched And feeling so much see cause  Everybody needs some good lovin'  Yo if I need it in the morning or the middle of the night I ain't 2 proud 2 beg (no) If the lovin' is strong then he got it goin' on and  I ain't 2 proud 2 beg (no) 2 inches or a yard rock hard or if it's saggin' I ain't 2 proud 2 beg (no) So it ain't like I'm braggin' just join the paddywagon cause I ain't 2 proud 2 beg, I ain't 2 proud 2 beg  Screaming' loud and holdin' sheets Scsared that you'll be called a freak Gotta let it go while you can Ain't 2 proud 2 beg you see Cause my man belongs 2 me And I know that he understands    Yo Left Eye kick that rap  Realize the realism of reality treats  Us both the same  Cause satisfaction is the name of this game So I choose to explain it's evident  Left Eye don't mean the rest of my body is irrelevant In outher words let's refresh your head  About pullin' down curtains and breakin' da waterbed Yeah I like it when you (kiss) Both sets of lips Oooh on the TLC tip  I ain't 2 proud 2 beg (I ain't 2 proud 2 beg) What I call my own Just you and me (uh) Heyyyyyyy    I ain't 2 proud 2 beg TLC isn't 2 proud 2 beg I ain't 2 proud 2 beg (no)"
It's So Hard to Say Goodbye to Yesterday,Boyz II Men,How do I say goodbye to what we had  The good times that made us laugh  Outweigh the bad.   I thought we'd get to see forever  But forever's gone away  It's so hard to say goodbye to yesterday.   I don't know where this road  Is going to lead  All I know is where we've been  And what we've been through.   If we get to see tomorrow  I hope it's worth all the wait  It's so hard to say goodbye to yesterday.   And I'll take with me the memories  To be my sunshine after the rain  It's so hard to say goodbye to yesterday.   And I'll take with me the memories  To be my sunshine after the rain  It's so hard to say goodbye to yesterday.
Move This,Technotronic,
Bohemian Rhapsody,Queen,"Is this the real life ? Is this just fantasy ? Caught in a landslide No escape from reality Open your eyes Look up to the skies and see I'm just a poor boy, I need no sympathy Because I'm easy come, easy go A little high, little low Anyway the wind blows, doesn't really matter to me, to me  Mama, just killed a man Put a gun against his head Pulled my trigger, now he's dead Mama, life had just begun But now I've gone and thrown it all away Mama, ooo Didn't mean to make you cry If I'm not back again this time tomorrow Carry on, carry on, as if nothing really matters  Too late, my time has come Sends shivers down my spine Body's aching all the time Goodbye everybody - I've got to go Gotta leave you all behind and face the truth Mama, ooo - (anyway the wind blows) I don't want to die I sometimes wish I'd never been born at all  I see a little silhouetto of a man Scaramouch, scaramouch will you do the fandango Thunderbolt and lightning - very very frightening me Gallileo, Gallileo, Gallileo, Gallileo, Gallileo Figaro - magnifico  But I'm just a poor boy and nobody loves me He's just a poor boy from a poor family Spare him his life from this monstrosity Easy come easy go - will you let me go Bismillah! No - we will not let you go - let him go Bismillah! We will not let you go - let him go Bismillah! We will not let you go - let me go Will not let you go - let me go (never) Never let you go - let me go Never let me go - ooo No, no, no, no, no, no, no - Oh mama mia, mama mia, mama mia let me go Beelzebub has a devil put aside for me For me For me  So you think you can stone me and spit in my eye So you think you can love me and leave me to die Oh baby - can't do this to me baby Just gotta get out - just gotta get right outta here  Ooh yeah, ooh yeah Nothing really matters Anyone can see Nothing really matters - nothing really matters to me  Anyway the wind blows..."
Tennessee,Arrested Development,"Lord I've really been real stressed Down and out, losin ground Although I am black and proud Problems got me pessimistic Brothers and sisters keep messin up Why does it have to be so damn tuff? I don't know where I can go To let these ghosts out of my skull My grandmas past, my brothers gone I never at once felt so alone I know you're supposed to be my steering wheel Not just my spare tire (home) But lord I ask you (home) To be my guiding force and truth (home) For some strange reason it had to be (home) He guided me to Tennessee (home)  (Chorus) Take me to another place Take me to another land Make me forget all that hurts me Let me understand your plan   Lord it's obvious we got a relationship Talkin to each other every night and day Although you're superior over me We talk to each other in a friendship way Then outta nowhere you tell me to break Outta the country and into more country Past Dyesburg into Ripley Where the ghost of childhood haunts me Walk the roads my forefathers walked Climbed the trees my forefathers hung from Ask those trees for all their wisdom They tell me my ears are so young (home) Go back to from whence you came (home) My family tree my family name (home) For some strange reason it had to be (home) He guided me to Tennessee (home)  Chorus  Now I see the importance of history Why people be in the mess that they be Many journeys to freedom made in vain By brothers on the corner playin ghetto games I ask you lord why you enlightened me Without the enlightment of all my folks He said cuz I set myself on a quest for truth And he was there to quench my thirst But I am still thirsty... The lord allowed me to drink some more He said what I am searchin for are The answers to all which are in front of me The ultimate truth started to get blurry For some strange reason it had to be It was all a dream about Tennessee  Chorus"
The Best Things in Life Are Free,Luther Vandross,
Make It Happen,Mariah Carey,Not more than three short years ago I was abandoned and alone Without a penny to my name So very young and so afraid No proper shoes upon my feet Sometimes I couldn't even eat I often cried myself to sleep But still I had to keep on going Never knowing if I could take it If I would make it through the night I held on to my faith I struggled and I prayed And now I've found my way  If you believe in yourself enough And know what you want You're gonna make it happen Make it happen And if you get down on your knees at night And pray to the Lord He's gonna make it happen Make it happen  I know life can be so tough And you feel like giving up But you must be strong Baby just hold on You'll never find the answers If you throw your life away I used to feel the way you do Still I had to keep on going Never knowing if I could take it If I would make it through the night I held on to my faith I struggled and I prayed And now I've finally found my way   I once was lost But now I'm found I got my feet On solid ground Thank you Lord If you believe Within your soul Just hold on tight And don't let go You can make it Make it happen 
The One,Elton John,I saw you dancing out the ocean Running fast along the sand A spirit born of earth and water Fire flying from your hands  In the instant that you love someone In the second that the hammer hits Reality runs up your spine And the pieces finally fit  And all I ever needed was the one Like freedom fields where wild horses run When stars collide like you and I No shadows block the sun You're all I've ever needed Baby you're the one  There are caravans we follow Drunken nights in dark hotels When chances breathe between the silence Where sex and love no longer gel  For each man in his time is Cain Until he walks along the beach And sees his future in the water A long lost heart within his reach
Set Adrift on Memory Bliss,P.M. Dawn,"The camera pans the cocktail glass, behind a blind of plastic plants; I found the lady with the fat diamond ring. then you know I can't remember a damn thing. I think it's one of those de ja vu things, or a dream that's tryin' to tell me something. Or will I ever stop thinkin' about it. I don't know, I doubt it. Subterranean by design, I wonder what I would find if I met you, let my eyes caress you, until I meet the thought of Missess Princess Who? Often wonder what makes her work. I guess I'll leave that question to the experts, assuming that there are some out there. they're probably alone, solitaire. I can remember when I caught up with a pastime intimate friend. She said, ""Bet you're probably gonna say I look lovely, but you probably don't think nothin' of me."" She was right, though, I can't lie. She's just one of those corners in my mind, and I just put her right back with the rest. That's the way it goes, I guess.  Baby you send me Set adrift on memory bliss of you  Careless whisper from a careless man, a neutron dance for a neutron fan; marionette strings are dangerous things, I thought of all the trouble they bring. An eye for an eye, a spy for a spy, rubber bands expand in a frustrating sigh. Tell me that she's not dreaming. She's got an ace in the hole, it doesn't have meaning. Reality used to be a friend of mine, 'cause complete control, I don't take too kind. Christina Applegate, you gotta put me on. Guess who's piece of the cake was Jacc Bond She broke her wishbone and wished for a sign. I told her whispers in my heart were fine. what did she think she could do? I feel for her, I really do. And I stared at the ring finger on her hand, I wanted her to be a big PM Dawn fan, but I had to put her right back with the rest. That's the way it goes, I guess.  Baby you send me... Set adrift on memory bliss of you"
Stay,Shakespears Sister,"If this world is wearing thin  And you're thinking of escape  I'll go anywhere with you  Just wrap me up in chains  But if you try to go alone  Don't think i'll understand   Stay with me stay with me  In the silence of your room  In the darkness of your dreams  You must only think of me  There can be no in between  When your pride is on the floor  I'll make you beg for more   Stay with me stay with me  You'd better hope and pray  That you make it safe  Back to your own world  You'd better hope and pray  That you wake one day  In your own world  'Cause when you sleep at night  They don't hear your cries  In your own world  Only time will tell if you can break the Sspell back in your own world   Stay with me stay with me Stay, stay with me  Stay..."
2 Legit 2 Quit,Hammer,
Please Don't Go,KWS,
Breakin' My Heart (Pretty Brown Eyes),Mint Condition,
Wishing on a Star,The Cover Girls,
She's Playing Hard to Get,Hi-Five,
I'd Die Without You,P.M. Dawn,
Good for Me,Amy Grant,You like to dance and listen to the music I like to sing with the band You like your hands splashing in the ocean Well I like my feet on the sand Does anybody have it any better? Isn't it easy to see just how well we fit together?  When I start to sing the blues You pull out my dancing shoes I think you could be so good for me You get brave when I get shy Just another reason why I think you could be so good for me So good.  You like to drive like Mario Andretti I like it taking my time But let me say wherever you are going You know it suits me just fine Does anybody have it any better? Isn't it easy to see just how well we fit together?  When I start to sing the blues You pull out my dancing shoes I think you could be so good for me You get brave when I get shy Just another reason why I think you could be so good for me So good.  Could be so good for me You could be so good Could be so good Could be so good for me.  You get brave when I get shy Another reason why You could be so good for Good for me baby Good for me baby When I want to sing the blues Good for me baby Oh when I want to sing the blues Good for me baby You could be so good Good for me baby When I want to sing the blues Good for me baby.
All I Want,Toad the Wet Sprocket,"nothing's so loud as hearing when we lie the truth is not kind and you've said neither am i         but the air outside so soft is saying everything         everything  all i want is to feel this way to be this close, to feel the same all i want is to feel this way the evening speaks, i feel it say...  nothing's so cold as closing the heart when all we need is to free the soul but we wouldn't be that brave i know         and the air outside so soft, confessing everything         everything  and it won't matter now whatever happens to me though the air speaks of all we'll never be it won't trouble me  and it feels so close let it take me in let it hold me so i can feel it say..."
When a Man Loves a Woman,Michael Bolton,"When a man loves a woman Can't keep his mind on nothin' else He'd trade the world For a good thing he's found If she is bad, he can't see it She can do no wrong Turn his back on his best friend If he puts her down  When a man loves a woman Spend his very last dime Trying to hold on to what he needs He'd give up all his comforts And sleep out in the rain If she said that's the way It ought to be  When a man loves a woman I give you everything I got (yeah) Trying to hold on To your precious love Baby please don't treat me bad  When a man loves a woman Deep down in his soul She can bring him such misery If she is playing him for a fool He's the last one to know Loving eyes can never see  Yes when a man loves a woman I know exactly how he feels 'Cause baby, baby, baby I am a man When a man loves a woman ¡¡"
I Can't Dance,Genesis,"Hot sun beating down burning my feet just walking around. Hot sun making me sweat 'Gators getting close, hasn't got me yet I can't dance, I can't talk. The only thing about me is the way I walk. I can't dance, I can't sing I'm just standing here selling everything. Blue jeans sitting ont he beach, her dog's talking to me, but she's out of reach. She's got a body under that shirt, but all she wants to do is rub my face in the dirt. Cos, I can't dance, I can't talk. The only thing about me is the way I walk. No, I can't dance, I can't sing I'm just standing here selling. And checking everything is in place, you never know who's looking on. Young punk spilling beer on my shoes, fat guy's talking to me trying to steal my blues. Thick smoke, see her smiling through. I never thought so much could happen just shooting pool. But I can't dance, I can't talk. The only thing about me is the way I walk. I can't dance, I can't sing I'm just standing here selling And checking everything is in place You never know who's looking on A perfect body with a perfect face"
Hazard,Richard Marx,"That boy's not right       Three years ago when I came to know Mary       First time that someone looked beyond the rumors and the lies       And saw the man inside       We used to walk down by the river        She loved to watch the sun go down       We used to walk along the river       And dream our way out of this town        No one understood what I felt for Mary       No one cared until the night she went out walking alone       And never came home       Man with a badge came knocking next morning       Here was I surrounded by a thousand fingers suddenly       Pointed right at me        I swear I left her by the river       I swear I left her safe and sound       I need to make it to the river       And leave this old Nebraska town        I think about my life gone by       How it's done me wrong       There's no escape for me this time       All of my rescues are gone, long gone        I swear I left her by the river       I swear I left her safe and sound       I need to make it to the river       And leave this old Nebraska town"
