Title,Artist,Lyrics
Mysterious Ways,U2,"Johnny take a walk with your sister the moon Let her pale light in to fill up your room You've been living underground Eating from a can You've been running away From what you don't understand... Love  She's slippy You're sliding down She'll be there when you hit the ground  It's alright, it's alright, it's alright She moves in mysterious ways It's alright, it's alright, it's alright She moves in mysterious ways  Johnny take a dive with your sister in the rain Let her talk about the things you can't explain To touch is to heal To hurt is to steal If you want to kiss the sky Better learn how to kneel  (on your knees boy)  She's the wave She turns the tide She sees the man inside the child  It's alright, it's alright, it's alright She moves in mysterious ways It's alright, it's alright, it's alright She moves in mysterious ways It's alright, it's alright, it's alright Lift my days, light up my nights  One day you will look...back And you'll see...where You were held...how By this love...while You could stand...there You could move on this moment Follow this feeling  It's alright, it's alright, it's alright She moves in mysterious ways It's alright, it's alright, it's alright She moves in mysterious ways It's alright, it's alright, it's alright  We move through miracle days Spirit moves in mysterious ways She moves with it She moves with it Lift my days, light up my nights"
Too Funky,George Michael,"Hey, you're just too funky for me, I gotta get inside of you, And I'll show you heaven if you let me. Hey you just too funky for me, I gotta get inside, (I gotta get inside) I gotta get inside of you (So then you will that be). I watch your fingers working overtime (Overtime), I got to thinking that they should be mine. Oh! I'd love to see you naked baby, I'd like to think that sometime maybe Tonight, if that's all right. Yeah!  Hey, you're just too funky for me, I gotta get inside of you , (Won't let you go) Won't let you, no-no Hey you're just too funky for me, I gotta get inside, (I gotta get inside) I gotta get inside of you (I'll let you love me). I watch you drinkin' and I take my time, I watch you drinkin' all that cheap red wine, Oh! I've got to see you naked baby, I'd like to think that sometime maybe, Tonight my goal's in sight, Yeah!  Baby, baby, baby Why do you do this to me? Won't let you go, (Won't let you go) You're such a, you're such a Baby, baby, baby Why do you do this to me? I've got to know. (I've got to know) (I'm gonna be the kind of lover that you never had) Hey you're just too funky. (You're never gonna have another lover in your bed) You're just too funky for me.  (Would you like me to seduce you, is that what you're trying to tell me?) (Everybody wants a lover like that) Baby (Everybody wants a lover like that) Yeah! Yeah! (Everybody wants a lover like that) Everybody, everybody (Everybody wants a lover like that) (Is that what you are trying to tell me?) (Everybody wants a lover, everybody wants a lover like that. Everybody wants a lover, everybody wants a lover like that. Everybody wants a lover, everybody wants a lover like that. Everybody wants a lover, everybody wants a lover like that.) (Would you like me to seduce you?) You're such a, you're such a (Would you like me to seduce you?) Yeah! Yeah! (Would you like me to seduce you?) you're such a, you're such a. Yeah! Yeah! (Would you stop playing with that radio Yorg, I'm trying to get to sleep!)"
How Do You Talk to an Angel,The Heights,
One,U2,"Is it getting better Or do you feel the same Will it make it easier on you now  You got someone to blame You say...  One love One life When it's one need In the night One love We get to share it Leaves you baby if you  Don't care for it  Did I disappoint you Or leave a bad taste in your mouth You act like you never had love And you want me to go without Well it's...  Too late Tonight To drag the past out into the light We're one, but we're not the same We get to  Carry each other Carry each other One...  Have you come here for forgiveness Have you come to raise the dead Have you come here to play Jesus To the lepers in your head  Did I ask too much More than a lot You gave me nothing Now it's all I got We're one But we're not the same Well we  Hurt each other Then we do it again You say Love is a temple Love a higher law Love is a temple Love the higher law You ask me to enter But then you make me crawl And I can't be holding on To what you got When all you got is hurt  One love One blood One life You got to do what you should One life With each other Sisters Brothers One life But we're not the same We get to  Carry each other Carry each other  One...life  One"
Keep on Walkin',CeCe Peniston,
Hold on My Heart,Genesis,Hold on my heart just hold on to that feeling we both know we've been here before we both know what can happen Hold on my heart cos I'm looking over you shoulder please don't rush in this time don't show her how you feel Hold on my heart throw me a lifeline I'll keep a place for you somewhere deep inside Hold on my heart please tell her to be patient cos there has never been a time that I wanted something more If I can recall this feeling and I know there's a chance oh I will be there yes I will be there be there for you whenever you want me to whenever you call I will be there Yes I will be there Hold on my heart don't let her see you crying no matter where I go she'll always be with me Hold on my heart just hold on to that feeling we both know we've been here before we both know what can happen So hold on my heart
The Way I Feel About You,Karyn White,
Beauty and the Beast,Celine Dion,"Tale as old as time True as it can be Barely even friends Than somebody bends Unexpectedly  Just a little change Small, to say the least Both a little scared Neither one prepared Beauty and the Beast  Ever just the same Ever a surprise Ever as before Ever just as sure As the sun will arise  Tale as old as time Tune as old as song Bittersweet and strange Finding you can change Learning you were wrong  Certain as the sun Rising in the east Tale as old as time Song as old as rhyme Beauty and the beast."
Warm It Up,Kris Kross,
In the Closet,Michael Jackson,"There's Something I Have To Say To You If You Promise You'll Understand I Cannot Contain Myself When In Your Presence I'm So Humble Touch Me Don't Hide Our Love Woman To Man  She's Just A Lover Who's Doin' Me By It's Worth The Giving It's Worth The Try You Cannot Cleave It Or Put It In The Furnace You Cannot Wet It You Cannot Burn It  She Wants To Give It (She Wants To Give It) (Aahh, She Wants To Give It) Dare Me (She Wants To Give It) (Aahh, She Wants To Give It) She Wants To Give It (She Wants To Give It) (Aahh, She Wants To Give It) (She Wants To Give It) (Aahh, She Wants To Give It)  It's Just A Feeling You Have To Soothe It You Can't Neglect It You Can't Abuse It It's Just Desire You Cannot Waste It Then, If You Want It Then, Won't You Taste It  She Wants To Give It (She Wants To Give It) (Aahh, She Wants To Give It) Dare Me (She Wants To Give It) (Aahh, She Wants To Give It) She Wants To Give It (She Wants To Give It) (Aahh, She Wants To Give It) (She Wants To Give It) (Aahh, She Wants To Give It)  One Thing In Life You Must Understand The Truth Of Lust Woman To Man So Open The Door And You Will See There Are No Secrets Make Your Move Set Me Free  Because There's Something About You Baby That Makes Me Want To Give It To You I Swear There's Something About You Baby  Just Promise Me Whatever We Say Or Whatever We Do To Each Other For Now We'll Make A Vow To Just  Keep It In The Closet  If You Can Get It It's Worth A Try I Really Want It I Can't Deny It's Just Desire I Really Love It 'Cause If It's Aching You Have To Rub It  She Wants To Give It (She Wants To Give It) (Aahh, She Wants To Give It) (She Wants To Give It) (Aahh, She Wants To Give It) She Wants To Give It (She Wants To Give It) (Aahh, She Wants To Give It) (She Wants To Give It) (Aahh, She Wants To Give It)  Just Open The Door And You Will See This Passion Burns Inside Of Me Don't Say To Me You'll Never Tell Touch Me There Make The Move Cast The Spell  Because There's Something About You Baby That Makes Me Want To Give It To You I Swear There's Something About You Baby That Makes Me Want  Just Promise Me Whatever We Say Or Do To Each Other For Now We'll Make A Vow To Just Keep It In The Closet  Because There's Something About You Baby That Makes Me Want To Give It To You Because There's Something About You Baby That Makes Me Want To Give It To You  I Swear There's Something About You Baby That Makes Me Want To Give It To You  I Swear There's Something About You Baby That Makes Me Want To Give It To You  I Swear There's Something About You Baby That Makes Me Want To Give It To You  Somethin' About You Baby That Makes Me Want  Just Promise Me Whatever We Say Or Whatever We Do To Each Other For Now We'll Make A Vow To Just Keep It In The Closet  (She Wants To Give It) Dare Me (Aahh) Keep It In The Closet ..."
People Everyday,Arrested Development,"See I was resting at the park minding my own business as I kick up the treble tone on my radio tape player box, right just loud enough so folks could hear it's hype, see ? Outta nowhere comes the woman I'm dating investigation maybe she was demonstrating But nevertheless I was pleased My day was going great and my soul was at ease until a group of brothers started bugging out drinking the 40 oz, going the nigga route Disrespecting my black queen holding their crotches and being obscene At first I ignored them cause see I know their type They got drunk and got guns and they wanna fight and they see a young couple having a time that's good and their egos wanna test a brother's manhood So they came to test Speech cause of my hair-do I was a target cause I'm a fashion misfit and the outfit that I'm wearing brothers dissing it Well I stay calm and pray the niggaz leave me be but they're squeezing parts of my date's anatomy Why, Lord, do brothers have to drill me ? Cause if I start to hit this man they'll have to kill me   I told the niggaz please let us pass, friend I said please cause I don't like killing Africans but he wouldn't stop and I ain't Ice Cube but I had to take the brother out for being rude and like I said before I was mad by then It took three or four cops to pull me off of him But that's the story y'all of a black man acting like a nigga and get stomped by an African "
No Son of Mine,Genesis,"Well the key to my survival was never in much doubt the question was how I could keep sane trying to find a way out Things were never easy for me peace of mind was hard to fin and I needed a place where I could hide somewhere I could call mine I didn't think much about it til it started happening all the time soon I was living with the fear everyday of what might happen that night I couldn't stand to hear the crying of my mother and I remember when i swore that, that would be the Last they'd see of me And I never went home again they say that time is a healer and now my wounds are not the same I rang the bell with my heart in my mouth I had to hear what he'd say He sat me down to talk to me he looked me straight in the eyes he said: You're no son, you're no son of mine You're no son, you're no son of mine You walked out, you left us behind and you're no son, no son of mine oh, his words how they hurt me, I'll never forget it and as the time, it went by, I lived to regret it You're no son, you're no son of mine but where should I go, and what should I do you're no son, you're no son of mine but I came here for help, oh I came here for you Well the years they passed so slowly I thought about him everyday what would I do, if we passed on the street would I keep running away in and out of hiding places soon I'd have to face the facts we'd have to sit down and talk it over and that would mean going back they say that time is a healer and now my wounds are not the same I rang that bell with my heart in my mouth I had to hear what he'd say He sat me down to talk to me he looked me straight in the eyes he said: You're no son, you're no son of mine You're no son, you're no son of mine When you walked out, you left us behind and you're no son, you're no son of mine oh, his words how they hurt me, I'll never forget it and as the time, it went by, I lived to regret it You're no son, you're no son of mine But where should I go and what should I do You're no son, you're no son of mine But I came here for help, oh I was looking for you You're no son, you're no son of mine - oh You're no son - ha yeah, ha yeah, ha yeah, ha yeah You're no son, you're no son of mine - oh, oh..."
Wildside,Marky Mark and the Funky Bunch,
Do I Have to Say the Words?,Bryan Adams,Rescue me from the mire Whisper words of desire Rescue me - darling rescue me With your arms open wide Want you here by my side Come to me - darling rescue me When this world's closing in There's no need to pretend Set me free - darling rescue me  I don't wanna let you go So I'm standing in your way I never needed anyone like I'm needin' you today  Do I have to say the words Do I have to tell the truth Do I have to shout it out Do I have to say a prayer Must I prove to you how good we are together Do I have to say the words  Rescue me from despair Tell me you will be there Rescue me - darlin' rescue me  Every dream that we share Every cross that we bear Come to me - darlin' rescue me
Friday I'm in Love,The Cure,i don't care if monday's blue tuesday's grey and wednesday too thursday i don't care about you it's friday i'm in love  monday you can fall apart tuesday wednesday break my heart thursday doesn't even start it's friday i'm in love  saturday wait and sunday always comes too late but friday never hesitate...  i don't care if monday's black tuesday wednesday heart attack thursday never looking back it's friday i'm in love  monday you can hold your head tuesday wednesday stay in bed or thursday watch the walls instead it's friday i'm in love  saturday wait and sunday always comes too late but friday never hesitate...  dressed up to the eyes it's a wonderful surprise to see your shoes and your spirits rise throwing out your frown and just smiling at the sound and as sleek as a shriek spinning round and round always take a big bite it's such a gorgeous sight to see you in the middle of the night you can never get enough enough of this stuff it's friday i'm in love
Everything About You,Ugly Kid Joe,"I, hate the rain and sunny weather And I, hate the beach and moutains too (and) I don't like a thing about the city, no, no And I, I, I, hate the country side too!  And I, hate everything about you! ...everything about you!  I don't like a thing about your mother And I, I hate your daddy's guts too I, don't like a thing about your sister 'cause I, I, I, think sex is overrated too.  And I, get sick when I'm around, I, can't stand to be around I, hate everything about you!  everything about you, everything about you, everything about you  Some say I got a bad attitude But that don't change the way I feel about you And if you think this might be bringing me down Look again cause I ain't wearin' no frown!  I don't really care about your sister Fuck the little bitch 'cause I already kissed her  One thing that I did to your lady Put her on the bed and she didn't say maybe I know you know everybody knows The way it comes, the way it's gonna' go  You think it's sad And that's too bad 'cause I'm havin' A ball hatin' Every little thing about you!  Everything about you, everything about I get sick when I'm around I can't stand to be around I hate everything about you"
Blowing Kisses in the Wind,Paula Abdul,"SO TELL BABY TELL YOUR TRUE HEART  SAY WHAT YOU SAY WHEN YOU'RE ALL ALONE  I'M TRYING  TRYING TO TRY  AND FEEL YOU  AND SEE IF I SEE  I'M FEELING ALONE   AND ALL I WANT IS  TO GET THROUGH  SO BABY, YOU'D SEE THAT THE  WAY YOU'RE LEAVING ME  IT WON'T DO  IT'S LIKE I'M...   BLOWING KISSES IN THE WIND  GIVIN' YOU LOVE THAT YOU HAVEN'T BEEN GIVEN  I CROSS MY HEART AND HOPE TO DIE  I'M ONLY WISHING YOU'D LOVE ME LIKE I   BLOWING KISSES IN THE WIND  WAITING, WAITING, WAITING  WAITING FOR YOU IS  ITS LIKE BLOWING, BLOWING KISSES   SO PLEASE BABY, PLEASE  RELEASE ME  IF TIME OVER TIME YOUR HEART'S GROWING COLD  I'M SAYING IF YOU DON'T BELIEVE IN BELIEVING  THEN HOW COULD TRUE LOVE EVER BE SO  AND ALL I WANT IS TO GET THROUGH  SO BABY, YOU'D SEE THAT THE WAY YOU'RE LEAVING ME  IT WON'T DO   IT'S LIKE I'M   LIKE I'M LIKE BLOWING KISSES   I'M SOME-BIDDY-BUM-BUM   LIKE I'M BLOWING KISSES   AND ALL I WANT IS TO GET THROUGH  SO BABY, YOU'D SEE THAT THE WAY YOU'RE LEAVING ME   IT WON'T DO   IT'S LIKE I'M...    LIKE I'M BLOWING KISSES IN THE WIND  LIKE I'M BLOWING KISSES IN THE WIND  LIKE I'M BLOWING KISSES IN THE WIND   WAITING FOR YOU IS   IS LIKE BLOWING, BLOWING KISSES"
Thought I'd Died and Gone to Heaven,Bryan Adams,"Love is forever - as I lie awake Beside you I believed - there's no heaven No hideaway - for the lonely  But I was wrong - crazy It's gotta be strong It's gotta be right  Only wanted to stay a while Only wanted to play a while Then you taught me to fly like a bird  Baby - thought I'd died and gone to heaven Such a night I never had before Thought I'd died and gone to heaven Cause what I got there ain't no cure for  Ooo it's so easy What you do to me all night angel I never loved - I swear to God Never needed no one, 'til you came along  Here I come baby It's gotta be strong - it's gotta be right Only wanted to stay awhile  Only wanted to play awhile Then you taught me to fly like a bird  Baby - thought I'd died and gone to heaven Such a night I never had before Thought I'd died and gone to heaven Cause what I got there ain't no cure for  I feel fast asleep - I feel drunk I dream the sweetest dreams Never wanna wake up  Never thought it could be this way No doubt about it - can't live without it Never thought it could be this good You made love to me - the way it oughta be"
Rhythm Is a Dancer,Snap!,"Chorus: Rhythym is a dancer, it's a soul's companion, you can feel it everywhere  Lift your hands and voices free your mind and join us you can feel it in the air  Ooh, it's a passion Ooh, you can feel it in the air Ooh, it's a passion Ooh, ooh, ooh, oh  back to top of chorus  A far away light in the futuristic place we might be, It's a tiny world just big enough to support the kingdom of one knowledgeable, throw away the loneliness and head back down, I'm going too fast, I'm going too fast  back to top of chorus  I plunge right on through the office door, and into the arms of the bottomless negro of love, suddenly I can't remember, how to stop, or turn around,  Do I have to get behind myself, Do I have to turn around before I can point, I flip 'til I can breathe  back to top of chorus"
Addams Groove,Hammer,
Missing You Now,Michael Bolton,"I talk to you but its not the same as touchin' you  And every time you whisper my name, I wanna run to you  We'll be together, it won't be long, it won't be long  But it feels like forever, and its hard to be strong   CHORUS Baby 'cause I'm missing you now  And its drivin' me crazy  How I'm needin' you baby  I'm missing you now  Can't wait till I'm alone with you  To show you how I'm missing you now   Wishin' you were here by my side is all that I can do  Got my arms around my pillow at night, they should be  holdin' you  Thought I was stronger, how could I know, how could  I know  I can't take this much longer, its so hard on my soul   CHORUS  Baby I just can't wait, till I see your face  Chase away this loneliness inside  When you're close to my heart, right here in my arms  Then and only then, will I be satisfied  I'm missing you now  We'll be together, it won't be long, it won't be long  But it feels like forever, and its hard to be strong"
Back to the Hotel,N2Deep,
Everything Changes,Kathy Troccoli,
Have You Ever Needed Someone So Bad,Def Leppard,"Here I am, I'm in the wrong bed again  It's just a game I just can't win  There you are breathin' soft on my skin  Still you won't let me in   Why save your kisses for a rainy day  Baby let the moment take your heart away   Have you ever needed someone so bad, yeah  Have you ever wanted someone  You just couldn't have  Did you ever try so hard  That your world just fell apart  Have you ever needed someone so bad  And you're the girl I gotta have  I gotta have you baby   There you go, midnight promises again  But they're broken by the dawn  You wanna go further, faster every day baby  But in the morning you'll be gone  And I'm alone    Every dream I dream is like  Some Kinda rash 'n' reckless scene  To give out such crazy love  ou must be some kinda drug  And if my time don't ever come  For me you're still the same  Damned if I don't, damned if I do  I gotta get a fix on you  "
Take This Heart,Richard Marx,"No one understands it more       You fear every step you take       So sure that your heart will break       It's not how the story ends       You'll be back on your feet again        Chorus       Baby, this time       There ain't nothing gonna take this heart away       No more goodbyes       There ain't nothing gonna take my heart away        The pain's still alive in you       For what one man put you through       You say that we're all the same       But I'm called by no other name       We all need a place to run       Won't you let me be the one        Repeat Chorus        Don't keep the dream in you locked outside your door       Just believe in this love       And don't be afraid anymore        I need you to please be strong       I've waited for you too long        Repeat Chorus        There ain't nothing gonna take this heart away       Oh whoah"
When I Look Into Your Eyes,FireHouse,Come with Us. Learn the Truth. We will appear to you From time to time.
I Wanna Love You,Jade,
Uhh Ahh,Boyz II Men,"Ten, nine, eight, seven, six  Five, four, three, two, one   Injection, follows.    Mike  Yes   The love I have right next to me  Is here and always will be  I'm caressing your body emotionally  As you can feel and will see   Why can't we go all the way to the top  The fullest extreme  The sounds I hear when you're with me  Express the way that you feel, girl  As you say -    In our passion sent we move in close  The love that we share is the same  I can tell when I reach down deep inside  You show it when you call out my name   Squeezing you tight and holding you close  Is all I feel inside  Although I try to hold in my love  It's something that I just can't hide    The music is low  The lights are dim, there we lie  Passion overflows  With every look in your eyes  Infatuation, lust  And a lot of love  Sweet caresses  Yes, it's food to be true  Enclench my back  Ecstasy fills the air  As you kiss on my neck  And stroke the back of my hair  To hold you tonight  I feel this is, my dear  To grasp, to hold  To rock that place    Give it to me, baby  I'll rub your back  As you lay here with me, yeah oh  I want you and I need you  Hold on to me, yeah  Right now, baby, oh, oh  And don't go away  Please, baby, stay with me  Oh I can do it to you  The way that nobody else can babe"
Real Love,Mary J. Blige,"(feat. Notorious B.I.G. & Puffy)  Yes indeed once again  For those who don't know  What the sounds of the youngest DJ in charge Ron G I wanna say whassup to Mary  And this that uptown classic  Give it to 'em Take 'em uptown to the Polo Ground Take 'em uptown to the Polo Ground Take 'em uptown to the Polo Ground Take 'em uptown to the Polo Ground  We are lovers true and through And though we made it through the storm I really want you to realize I really want to put you on I've been searching for someone To satisfy my every need Won't you be my inspiration Be the real love that I need  I'm searching for the real love Someone to set my heart free Real love I'm searching for a real love  Oh when I met you I just knew That you would take my heart and run Until you told me how you felt for me You said I'm not the one So I slowly came to see All of the things that you were made of And now I hope my dreams and inspiration Lead me towards a real love   I've got to have a real love Love so true and oh, baby I thought that love was you I thought you were the answer To the question in my mind But it seems that I was wrong If I stay strong maybe I'll find a  Look up in the sky It's a bird, it's a plane Nope, it's Mary Jane, ain't a damn thing changed Kickin' ill flava with the Teflon Don Record shop getting props She got it goin' on So what's it gonna be The real one, the fake one  Ya need a minute to think for whom ya better take What up My time is up Peace out to brooklyn  Helpin' daddy-o hey yo, bring the verse in  So I try my best and pray to God He'd send me someone real To caress me and to guide me Towards a love my heart can feel Now I know I can be faithful I can be your all and all And give you good lovin' through the summertime Winter, spring and fall   You see I'm searching for a real love And I don't know where to go I've been around the world and high and low And still will never know How it feels to have a real love Cuz it seems there's none around I gotta end it in this way Because seems he can't be found   It's that flavor That's what I'm talking about Ain't no other way to explain it"
Justified and Ancient,The KLF,
